{
  "rfc_id": "RFC-0000",
  "title": "What an RFC Is",
  "version": "0.1.0",
  "status": "draft",
  "phase": "spec",
  "owners": ["@your-handle"],
  "created": "2026-01-17",
  "sections": [
    {
      "title": "Summary"
    },
    {
      "title": "Specification"
    },
    {
      "title": "Definition",
      "clauses": ["clauses/C-RFC-DEF.json"]
    },
    {
      "title": "Lifecycle",
      "clauses": [
        "clauses/C-STATUS-LIFECYCLE.json",
        "clauses/C-PHASE-LIFECYCLE.json"
      ]
    }
  ],
  "changelog": [
    {
      "version": "0.1.0",
      "date": "2026-01-17",
      "summary": "Initial draft"
    }
  ]
}
