{
  "rfc_id": "RFC-0001",
  "title": "PhaseOS Vision",
  "version": "0.1.0",
  "status": "draft",
  "phase": "spec",
  "owners": [
    "@your-handle"
  ],
  "created": "2026-01-17",
  "sections": [
    {
      "title": "Summary"
    },
    {
      "title": "Specification"
    },
    {
      "title": "Vision",
      "clauses": [
        "clauses/C-VISION.json"
      ]
    }
  ],
  "changelog": [
    {
      "version": "0.1.0",
      "date": "2026-01-17",
      "summary": "Initial draft"
    }
  ]
}