{
  "rfc_id": "RFC-0002",
  "title": "Phase Discipline",
  "version": "0.1.0",
  "status": "draft",
  "phase": "spec",
  "owners": ["@your-handle"],
  "created": "2026-01-17",
  "sections": [
    {
      "title": "Summary"
    },
    {
      "title": "Specification"
    },
    {
      "title": "Phase Rules",
      "clauses": ["clauses/C-PHASE-ORDER.json"]
    }
  ],
  "changelog": [
    {
      "version": "0.1.0",
      "date": "2026-01-17",
      "summary": "Initial draft"
    }
  ]
}
